id,position,country,jurisdiction,deputy,list,start,end,before,after,enwiki
Q1370482,President of Cuba,Q241,Q241,Q21071159,,1902,,,,President of Cuba
Q21071159,Vice-President of Cuba,Q241,Q241,,,1976-12-02,,,,Vice President of Cuba
Q6502015,Prime Minister of Cuba,Q241,Q241,,Q375886,1940-10-10,,,,Prime Minister of Cuba
Q4294907,Minister of Foreign Affairs of Cuba,Q241,Q241,,Q16188326,,,,,Minister of Foreign Affairs (Cuba)
Q99883982,Minister of Industry of Cuba,Q241,Q241,,,,,,,
Q99880254,President of the National Assembly of People's Power,Q241,Q241,,Q11812611,,,,,
